{
  "schemaVersion": 1,
  "chainId": 1,
  "architecture": "v1-to-v2-migration",
  "sourceSnapshot": {
    "path": "deployments/1/legacy-v1.json",
    "tag": "v1-final",
    "commit": "45651a4ecee20b80e55d941d295dbdf6fa4ea5e6"
  },
  "v2ManifestPath": "deployments/1/v2.json",
  "statusSemantics": {
    "waiting-for-reviewed-v2-replacement": "Retained as documented V1 standby coverage while a reviewed V2 replacement is pending. This status does not prove current Chief authorization or readiness; incident-time validation remains required.",
    "deprecated-v1": "Deprecated in the signed V1 snapshot and excluded from incident use.",
    "superseded-by-v2": "Replaced by the referenced incident-ready V2 deployment.",
    "retained-v1-exception": "Intentionally retained as documented V1 standby coverage with an explicit rationale."
  },
  "counts": {
    "waitingForReviewedV2Replacement": 49,
    "deprecatedV1": 25,
    "supersededByV2": 0,
    "retainedV1Exception": 0,
    "total": 74
  },
  "records": [
    {
      "name": "SPBEAMHaltSpell",
      "kind": "standalone",
      "address": "0xDECF4A7E4b9CAa3c3751D163866941a888618Ac0",
      "legacySnapshotStatus": "active",
      "migrationStatus": "waiting-for-reviewed-v2-replacement",
      "owner": "unassigned",
      "ownerEvidence": "Publication and revocation ownership remains unresolved in the pinned V2 design.",
      "evidence": "Classified active in the signed v1-final README snapshot; no reviewed V2 replacement is published in deployments/1/v2.json."
    },
    {
      "name": "SplitterStopSpell",
      "kind": "standalone",
      "address": "0x12531afC02aC18a9597Cfe8a889b7B948243a60b",
      "legacySnapshotStatus": "active",
      "migrationStatus": "waiting-for-reviewed-v2-replacement",
      "owner": "unassigned",
      "ownerEvidence": "Publication and revocation ownership remains unresolved in the pinned V2 design.",
      "evidence": "Classified active in the signed v1-final README snapshot; no reviewed V2 replacement is published in deployments/1/v2.json."
    },
    {
      "name": "MultiClipBreakerSpell",
      "kind": "registry-global",
      "address": "0x828824dBC62Fba126C76E0Abe79AE28E5393C2cb",
      "legacySnapshotStatus": "active",
      "migrationStatus": "waiting-for-reviewed-v2-replacement",
      "owner": "unassigned",
      "ownerEvidence": "Publication and revocation ownership remains unresolved in the pinned V2 design.",
      "evidence": "Classified active in the signed v1-final README snapshot; no reviewed V2 replacement is published in deployments/1/v2.json."
    },
    {
      "name": "MultiLineWipeSpell",
      "kind": "registry-global",
      "address": "0x4B5f856B59448304585C2AA009802A16946DDb0f",
      "legacySnapshotStatus": "active",
      "migrationStatus": "waiting-for-reviewed-v2-replacement",
      "owner": "unassigned",
      "ownerEvidence": "Publication and revocation ownership remains unresolved in the pinned V2 design.",
      "evidence": "Classified active in the signed v1-final README snapshot; no reviewed V2 replacement is published in deployments/1/v2.json."
    },
    {
      "name": "MultiOsmStopSpell",
      "kind": "registry-global",
      "address": "0x3021dEdB0bC677F43A23Fcd1dE91A07e5195BaE8",
      "legacySnapshotStatus": "active",
      "migrationStatus": "waiting-for-reviewed-v2-replacement",
      "owner": "unassigned",
      "ownerEvidence": "Publication and revocation ownership remains unresolved in the pinned V2 design.",
      "evidence": "Classified active in the signed v1-final README snapshot; no reviewed V2 replacement is published in deployments/1/v2.json."
    },
    {
      "name": "GroupedClipBreakerFactory",
      "kind": "factory",
      "address": "0x867852d30bb3cb1411fb4e404fae28ef742b1023",
      "legacySnapshotStatus": "active",
      "migrationStatus": "waiting-for-reviewed-v2-replacement",
      "owner": "unassigned",
      "ownerEvidence": "Publication and revocation ownership remains unresolved in the pinned V2 design.",
      "evidence": "Classified active in the signed v1-final README snapshot; no reviewed V2 replacement is published in deployments/1/v2.json."
    },
    {
      "name": "GroupedLineWipeFactory",
      "kind": "factory",
      "address": "0x8646f8778b58a0df118facedf522181ba7277529",
      "legacySnapshotStatus": "active",
      "migrationStatus": "waiting-for-reviewed-v2-replacement",
      "owner": "unassigned",
      "ownerEvidence": "Publication and revocation ownership remains unresolved in the pinned V2 design.",
      "evidence": "Classified active in the signed v1-final README snapshot; no reviewed V2 replacement is published in deployments/1/v2.json."
    },
    {
      "name": "SingleDdmDisableFactory",
      "kind": "factory",
      "address": "0x8BA0f6C4009Ea915706e1bCfB1d879E34587dC69",
      "legacySnapshotStatus": "active",
      "migrationStatus": "waiting-for-reviewed-v2-replacement",
      "owner": "unassigned",
      "ownerEvidence": "Publication and revocation ownership remains unresolved in the pinned V2 design.",
      "evidence": "Classified active in the signed v1-final README snapshot; no reviewed V2 replacement is published in deployments/1/v2.json."
    },
    {
      "name": "SingleOsmStopFactory",
      "kind": "factory",
      "address": "0x83211c74131bA2B3de7538f588f1c2f309e81eF0",
      "legacySnapshotStatus": "active",
      "migrationStatus": "waiting-for-reviewed-v2-replacement",
      "owner": "unassigned",
      "ownerEvidence": "Publication and revocation ownership remains unresolved in the pinned V2 design.",
      "evidence": "Classified active in the signed v1-final README snapshot; no reviewed V2 replacement is published in deployments/1/v2.json."
    },
    {
      "name": "SingleLitePsmHaltFactory",
      "kind": "factory",
      "address": "0xB261b73698F6dBC03cB1E998A3176bdD81C3514A",
      "legacySnapshotStatus": "active",
      "migrationStatus": "waiting-for-reviewed-v2-replacement",
      "owner": "unassigned",
      "ownerEvidence": "Publication and revocation ownership remains unresolved in the pinned V2 design.",
      "evidence": "Classified active in the signed v1-final README snapshot; no reviewed V2 replacement is published in deployments/1/v2.json."
    },
    {
      "name": "StUsdsRateSetterDissBudFactory",
      "kind": "factory",
      "address": "0xb3Fd827F58989cFacFE50d2F8e86A1113b6066D1",
      "legacySnapshotStatus": "active",
      "migrationStatus": "waiting-for-reviewed-v2-replacement",
      "owner": "unassigned",
      "ownerEvidence": "Publication and revocation ownership remains unresolved in the pinned V2 design.",
      "evidence": "Classified active in the signed v1-final README snapshot; no reviewed V2 replacement is published in deployments/1/v2.json."
    },
    {
      "name": "StUsdsWipeParamFactory",
      "kind": "factory",
      "address": "0x768D5Ce639c7E7d51E1244E2634d6149bd0d8096",
      "legacySnapshotStatus": "active",
      "migrationStatus": "waiting-for-reviewed-v2-replacement",
      "owner": "unassigned",
      "ownerEvidence": "Publication and revocation ownership remains unresolved in the pinned V2 design.",
      "evidence": "Classified active in the signed v1-final README snapshot; no reviewed V2 replacement is published in deployments/1/v2.json."
    },
    {
      "name": "GroupedClipBreakerSpell",
      "kind": "grouped",
      "subject": "ETH-A,ETH-B,ETH-C",
      "address": "0x7d50528DE0F6117dA4e7bDC3dc15EDF78f8f175f",
      "legacySnapshotStatus": "active",
      "migrationStatus": "waiting-for-reviewed-v2-replacement",
      "owner": "unassigned",
      "ownerEvidence": "Publication and revocation ownership remains unresolved in the pinned V2 design.",
      "evidence": "Classified active in the signed v1-final README snapshot; no reviewed V2 replacement is published in deployments/1/v2.json."
    },
    {
      "name": "GroupedClipBreakerSpell",
      "kind": "grouped",
      "subject": "LSE-MKR-A",
      "address": "0xc75Bc88b5d1A220E982AabAd3142f75B14D0009b",
      "legacySnapshotStatus": "active",
      "migrationStatus": "waiting-for-reviewed-v2-replacement",
      "owner": "unassigned",
      "ownerEvidence": "Publication and revocation ownership remains unresolved in the pinned V2 design.",
      "evidence": "Classified active in the signed v1-final README snapshot; no reviewed V2 replacement is published in deployments/1/v2.json."
    },
    {
      "name": "GroupedClipBreakerSpell",
      "kind": "grouped",
      "subject": "WBTC-A,WBTC-B,WBTC-C",
      "address": "0x8d1E22d6490FEf486309C6430140b9f1f12D31ED",
      "legacySnapshotStatus": "active",
      "migrationStatus": "waiting-for-reviewed-v2-replacement",
      "owner": "unassigned",
      "ownerEvidence": "Publication and revocation ownership remains unresolved in the pinned V2 design.",
      "evidence": "Classified active in the signed v1-final README snapshot; no reviewed V2 replacement is published in deployments/1/v2.json."
    },
    {
      "name": "GroupedClipBreakerSpell",
      "kind": "grouped",
      "subject": "WSTETH-A,WSTETH-B",
      "address": "0xa383fF9F207202A7A4C750E2395B8793f9D2Ff84",
      "legacySnapshotStatus": "active",
      "migrationStatus": "waiting-for-reviewed-v2-replacement",
      "owner": "unassigned",
      "ownerEvidence": "Publication and revocation ownership remains unresolved in the pinned V2 design.",
      "evidence": "Classified active in the signed v1-final README snapshot; no reviewed V2 replacement is published in deployments/1/v2.json."
    },
    {
      "name": "SingleDdmDisableSpell",
      "kind": "leaf",
      "subject": "DIRECT-SPARK-DAI",
      "address": "0xf10d37FC47e966508A62d4874dC69c7Ed62fd11B",
      "legacySnapshotStatus": "active",
      "migrationStatus": "waiting-for-reviewed-v2-replacement",
      "owner": "unassigned",
      "ownerEvidence": "Publication and revocation ownership remains unresolved in the pinned V2 design.",